{
  "project_code": "OSS-BLIND-R4",
  "project_name": "Open Source Blind Test Final Round",
  "business_line": "public-pr-evaluation",
  "created_at": "2026-09-22T02:44:19.067312+00:00",
  "updated_at": "2026-09-22T13:13:56",
  "status": "active",
  "asset_model": "work_item_truth",
  "default_work_item_level": "M",
  "paths": {
    "inputs_common": "inputs/common/",
    "work_items": "work_items/",
    "indexes": "indexes/",
    "reports": "reports/",
    "knowledge": "knowledge/"
  }
}
