{
  "project_code": "WX-YGJ",
  "project_name": "云挂机",
  "business_line": "云挂机",
  "created_at": "2026-07-27T07:33:54.641441+00:00",
  "updated_at": "2026-08-26T23:00:25",
  "status": "active",
  "asset_model": "work_item_truth",
  "default_work_item_level": "M",
  "paths": {
    "inputs_common": "inputs/common/",
    "work_items": "work_items/",
    "indexes": "indexes/",
    "reports": "reports/",
    "knowledge": "knowledge/"
  }
}
